{
  "v": 1,
  "item": {
    "id": "1002",
    "name": "선택옵션 없는 예시 강좌",
    "basic": "하네스용 예시 강좌입니다. 실제 강좌가 아닙니다.",
    "category": {
      "id": "101010",
      "name": "인문논술",
      "requiresCertification": false,
      "requiresAdultCertification": false
    },
    "price": 148500,
    "listPrice": 220000,
    "priceOnInquiry": false,
    "soldOut": false,
    "inStock": true,
    "buyMinQty": 1,
    "images": ["/data/item/1002/thumb.png"],
    "descriptionHtml": "<p>선택옵션이 없는 강좌입니다.</p>",
    "headHtml": "",
    "tailHtml": "",
    "information": { "product_name": "예시 수강대상", "model_name": "예시 내용 및 특징" },
    "extra": { "1": "80", "2": "5", "3": "26.10.06 ~", "4": "60", "5": "1" }
  },
  "options": { "subjects": [], "supplySubjects": [], "items": [] },
  "reviewSummary": { "count": 0, "averageScore": null },
  "form": { "action": "/shop/cartupdate.php", "method": "POST" }
}
