{
  "v": 1,
  "item": {
    "id": "1004",
    "name": "전화문의 예시 강좌",
    "basic": "하네스용 예시 강좌입니다. 실제 강좌가 아닙니다.",
    "category": {
      "id": "101030",
      "name": "논술 상담",
      "requiresCertification": false,
      "requiresAdultCertification": false
    },
    "price": 0,
    "listPrice": 0,
    "priceOnInquiry": true,
    "soldOut": false,
    "inStock": true,
    "buyMinQty": 1,
    "images": [],
    "descriptionHtml": "<p>가격을 전화로 문의하는 강좌입니다.</p>",
    "headHtml": "",
    "tailHtml": "",
    "information": { "product_name": "예시 수강대상", "model_name": "예시 내용 및 특징" },
    "extra": { "1": "", "2": "", "3": "", "4": "", "5": "" }
  },
  "options": { "subjects": [], "supplySubjects": [], "items": [] },
  "reviewSummary": { "count": 0, "averageScore": null },
  "form": { "action": "/shop/cartupdate.php", "method": "POST" }
}
